text,label
i learned in the foundry of my own childhood that humor made a perfect shield for keeping people at bay for helping me conceal my true feelings for lending the appearance of truth to all the lies i would tell about how happy i was and for providing me with the wherewithal to get through each day,1
id never do but i woke feeling stressed,0
i feel i need to put my beloved uggs to one side and get back on the ballet pump bandwagon,2
i feel terrible about the lady driver though,0
i had a pretty trying adolescence and any time im put into a situation where im made to feel inadequate it makes me revert right back into the shy awkward teenager with low self esteem that i was in high school,0
i am being told i should feel satisfied because i am in good standing with the powers that be,1
i actually just feel really eager,1
im sitting here in the belmont library listening to hold on tight by electric light orchestra feeling a bit of discontent,0
i feel really bless to have a very supportive family who appreciate everything that i do,2
i feel so welcomed,1
i shut the door but i didn t feel triumphant,1
i was feeling pretty wiped out mentally amp physically i was determined to get some oxygen to my brain,1
i said in some recent interviews we will have two guests on the next alcest album and today i feel glad to reveal the first one,1
my roommate was rude to me,3
i feel so weird not saying goodnight to mike,5
i feel lighter and more compassionate after i have these little talks with myself,2
i was impressed with how dunham portrayed hannahs whole experience from trying to deny that its happening to feeling offended when you feel like someone is trying to minimise the distress its causing you,3
i watched his face contort in sadness i began to feel regretful of my actions,0
i have been stumbling into quote after quote urging me because i really do feel they are meant for me to do away with my hated day job and dedicate my efforts to what matters most,0
i prayed to trust god with my desire to feel a divine sense of home,1
i found is that feeling worthless is a waste of time,0
i feel totally carefree with them around,1
i will not go into details from that long night but i woke up for our am bus feeling like i could barely stand and not trusting the pit in my stomach,1
i feel so incredibly graceful and sexy in this pose i have to say,1
i feel unimportant but even if i am in some way its still not my place to be making any decisions or voicing my opinions and its certainly not my place to be sharing my feelings,0
i am learning to step back and call it out to not be too proud to admit that yes i am feeling annoyed and yes i should tell you why,3
i want to avoid feeling disliked,0
i feel pretty lame typing that but my upper body is so weak,0
i feel very needy,0
i feel and i think that should be respected,1
i was feeling a little like a cold was coming on,3
i just wanna say that the last three months i feel so happy about my blog,1
i left feeling defeated like nothing had been accomplished the day a complete waste of time amp energy,0
i had ritz crackers in my desk drawer because theyre something ill eat even when i feel crappy and or dont feel like eating,0
i feel that tenure protects a lot of teachers that r innocent,1
i always feel i always understand that the people who are being the most hateful and harmful towards me are hurting themselves and taught wrongly and i hurt for them because i want to go back and undo the pain and childhood bigotry that binds their lives into this path,3
i did wake up this morning feeling more like myself so after days of sloth i was keen to get geared up and head to higher altitudes,1
i feel like the character precious,1
i feel in love with the weight watchers program and was faithful to count my points,2
i feel like one of those girls in school that i hated because their outfits were perfect everyday because they went shopping once a week,0
i fought i could feel myself trusting this man who was so patient and had a cool confidence more and more,1
i feel like my very essence is no more and work has drained my soul hopefully soon i will find my escape from work into a better path as i seem to be stuck only the cliquey get to move on and i do not want to roll like that,0
i feel surprised because i didnt expect it,5
i feel tortured by something,3
i feel suffocated yet charmed my brain pauses logic,1
i was feeling groggy and super tired during most of the fall we ended up staying home for thanksgiving instead of making the hour trip to see jimmys family,0
i had coped for barely twenty four hours before i was feeling wrung out and distraught,4
i feel that the father wants to tell you that he is pleased with you,1
i uploaded and put the link to in my previous post is only good for six more days or until i feel gracious enough to upload it again,1
im pretty sure it had to do with the fact that im dealing with hyperemesis not enough sleep and feeling irritable,3
i wanted to feel assured,1
i feel like copying the handsome boy say yay so fun,1
i am sorry that you feel i deserve to be blamed for the friends i pick all of which are better then some of the friends i could be hanging out with getting high and drunk while underage,0
i feel that it is dangerous to portray angels as walking the earth and intermarrying with humans,3
i am feeling a bit nostalgic so decided to take a tour through my memory lane,2
i feel excited about something that is soley for me here is the video about it,1
i feel like i m a doomed gladiator in a stadium constructed of cardboard and copies of romeo and juliet and the outsiders are screaming for my blood,0
i think she just rolled out i guess she s over it already i m kinda feeling that but no one has performed yet and word on the street is there is supposed to be a surprised performance by lil wayne nikki minaj and drake that would be dope,5
i feel a tender compassion glancing at her huge and heavy rucksack,2
i feel romantic and passionate toward my partner,2
i hated the day job and after a few months of feeling like i was being cosmically punished for doing a good deed i was getting ready to quit when i met the woman that would become my wife,0
i feel ashamed that i again let it come that far,0
i feel a little ashamed that i had such low expectations in the first place,0
i started feeling very gentle contractions about minutes apart,2
i feel like im being a terrible person and that hes going to hate me for thinking these things,0
i feel like a post might be devoted to dealing with emotions caused by situations vs,2
i flung into my suitcase at the last minute didn t break on the crossing over or explode in the pressurized cabin so thus far i m feeling pretty splendid about things,1
i need to listen to a song where i can be angry and feel accepted at the same time,1
i find myself seeking and yearning for love and acceptance from people that can not provide it and then being disappointed when i am alone and feeling unloved and unworthy,0
i feel accepted and appreciated by my teammates and peers,2
i know that feeling for sure,1
i was left feeling bothered by it for a long time afterwards,3
i feel like hopeless helpless worthless scum,0
i feel so blessed to have both lisa and god as friends in this life,1
i stopped feeling bitter and sorry for myself and lost myself in the work my work started getting better or rather continued to get better,3
i am still feeling a little remorseful that we didnt just break down and buy it,0
i feel more and more stressed,3
i do not feel like i am intelligent enough to be a teacher,1
i feel naughty just being this girls friend,2
i would stay in charge thereby helping z to feel safe yet at the same time be nurturing and loving,1
i fully enjoy music when i feel afraid using headphones,4
i feel so cranky right now,3
i feel all festive sitting down with my address book and list christmas songs in the background and writing a personal message in each one congratulations on your exam results,1
ive had so much more energy no more slugging around feeling lethargic after massive takeaways and choccy binges and my skin started to clear up instantly,0
i feel pretty insecure about my current relationship,4
i enjoy hearing the faith stories of other believers sometimes these stories leave me feeling inadequate and guilty,0
i feel like ending my life like some song from damaged or something,0
i feel totally rejected,0
i say no i feel guilty begins by giving you the reasons for and benefits of being assertive without being aggressive,0
i feel more jaded,0
i feel a little strange chasing after them since im so disappointed in the brand as a whole,4
i didn t feel too hot from the swim,2
i was to her in fact so i m taking that as she feels regretful for what she has done,0
i feel embarrassed by it,0
i perceive you feel the dint of pity these are gracious drops,1
i always feel slightly worthless almost self condemning like i should be doing more amounting more saving the world one day at a time a preacher on a podium a counselor for teen single struggling mom s a writer a motivational speaker a super mom to my baby boy,0
i chose to live my life as a normal person who has feelings wants and desires i have talked up for myself been faithful to myself and i have been determined to be treated with dignity and respect,2
i feel this violence is petty and impractical,3
im feeling a bit more sociable now although i dont think ill be able to express everything i want to say,1
i try not to laugh because sometimes it hurts vellas feelings but some of the things he does are so funny,5
i love tall guys they make me feel so little and innocent however innocent was the last thing that i was that night,1
i feel strongly about or a line that i want to draw in the sand so to speak i shouldn t be afraid especially at this point to bring up how i feel about what my conclusion should entail etc,4
i feel civilly disturbed class delicious title share this on del,0
i still feel its a little shaky at times and can move into the slightly odd jades hair in particular seems prone to this but generally it works well with spencers writing,4
i feel is a dumb plot idea,0
im doing things that make me feel brave and strong i have a a href http derfwadmanor,1
i just feel cold and drained all the time im either hungry or tired or cold at the moment and it sort of sucks,3
i have to leave my hair alone now if im feeling impatient,3
i feel not surprised by where i ended up i m happy with a lot of what i ve achieved the positions i ve put myself in,5
i just love the colors and the way the yarns feel i also love supporting small businesses and it allows me to provide quality products in my own shop,1
i am not normally the kind of person who gets emotional upon meeting a public figure but as strange as it sounds seeing you yesterday for the first time ever the feeling came over me was the feeling one might feel upon seeing a beloved favorite loving aunt lol,2
i am reliving all of the feelings of being rejected less than and not good enough from years ago,0
i love a movie with a good feel to it that really keeps you enthralled and the road has just that,5
i was feeling quite casual that day,1
i should feel like successful independent woman a la destinys child no,1
i feel funny telling you about my name change anyway gracias por todo,5
i feel guilty to my family my friends who made the introduction for me to that job and somehow i even feel guilty to my boss even though he fooled and lied to me,0
i feel lovely,2
i remember feeling more amused than sensing that i was in any real danger however i must have been experiencing a little bit of shock,1
i feel greedy but too idealistic what is it to expect she would want you to talk to me your proported best friend that she might be happy you have me,3
im feeling a little gun shy about this,4
i feel a bit stressed so i get up and take two rescue tablets,0
i feel im being hated,0
i am feeling so morose right now i hate how little things like this have enough power to distract me from my day to day life,0
i also like to knit but dont do it as intensely as when i was nowadays i mostly knit socks which gives me the feeling that watching tv isnt that useless because i can knit while watching a film or series,0
i was afraid to clean nicos ears but after his doctor showed me how then i didnt feel like i could hurt him,0
i feel that now i am a lot less irritable than i was before,3
i tend to think that it kinda contributed to my medium intelligence and made me understand and feel things in a clever and sensible way in the visual arts field especially but i m always feeling that i m losing that more and more,1
i think a lot of the fun there is in meeting the players expectation and making the player feel clever making it seem like they re not just clicking on an option you know,1
ive had that vomity shocked feeling from jealousy before and its not something you want to keep feeling and its definitely something you want to get resolved as soon as possible,1
i like to read this when i am feeling inadequate i know mistakes happen and sometimes they are the perfect mistake,0
i am sure at least i hope so that the woman who responded by saying so that he could help out with the kids also feel this way but what surprised me was that all the reasons i listed above were second,5
i loved the feeling i got during an amazing slalom run whether it was in training or in a race,5
i felt out of control i hated myself for feeling it then felt more out of control hated myself for hating that i hated it and it just got worse until i was walking to work in a haze trying to not curl up on the pavement and just,3
i have a feeling if he balks at the soup it will be divine enough for me to finish all by myself,1
i feel festive,1
ill smoke a few cigarettes because im feeling a little nervous,4
i may not feel hopeful and many days i do not but these truths i must call to mind the lord is my portion therefore i will hope in him,1
i just feel heartbroken vunerable and sick tonight,0
im feeling very indecisive about turning eighteen but hey the age does come with its own ups and downs right,4
i stop feeling so mad i ll stop behaving like this,3
i invite him to send me an email detailing all the ways he feels that ive wronged him and i promise to post it unedited outside of names or what not in this blog,3
i was feeling so reluctant the whole day today the only thing that i feel like doing is just sticking my ass on the benches ground having heart to heart talks with my favs staring into space and nothing,4
im feeling hot already after tackling the front hedge,2
im feeling confused but ill keep trudging through,4
im feeling quite cold actually,3
this happened when i could not get into the school i had initially wanted,3
i feel that is why she suddenly got mad at mom,3
i could also feel very bad about myself for not being able to keep up,0
i feel scared and stupid,4
i feel like our relationship revovles around sex and when we do he wants it to be really adventurous trying new things using toys etc ansi just find it exhausting trying to keep up,1
i try to feel confident about it but when ever our eyes meet i feel strong like in gym we have the exercise machines and i could only do lbs on average and i always wanted to do,1
i feel about them i still end up nervous and have those naughty butterflies flying around my stomach,4
i am feeling very anxious about going to therapy w,4
i feel angry thinking how much the government has gulped away over money,3
i am feeling a bit adventurous i put on red lipstick rouge artist and intense from make up for ever,1
i have no idea why this particular region seems to lack a visibly necessary outer carniola as well and i feel actually somewhat bothered by this possible evidence of lack of suburban spirit,3
im putting it in my palm and blowing on it hoping it gets to the ears of the universe and its feeling a little generous the day it reaches them,1
i am feeling generous so you can pick any reason you like but make sure you take your wise mothers advice so i dont feel the need to drag all this to court,1
i feel like telling these horny devils to find a site more suited to that sort of interest the playboy if there is one forum perhaps,2
i used to get the worthless feeling like i said previously my gear was going on ebay but now catch or not i m not bothered it is all about having a go i think a little more when fish are thin on the ground but not dejected or angry,3
i understand the logic of having a student congress but i cant help but feel thats its really really really boring,0
i am feeling unsure about my words but it also means i am writing which is good,4
i want to be someone that people can approach and feel accepted by and not judged because i do feel that people feel judged by me,1
i has for this other woman she feels greedy and wants kairi all for herself,3
i can admit that even though i feel horrible now,0
i feel almost angry that i have been fed like a lab rat for so many years,3
i feel totally drained emotionally and physically the holy spirit never ceases to fill me up and speak to me,0
i feel very nostalgic because i have enjoyed this essence,2
i feel myself getting agitated over something insignificant or feeling bored i m going to remember this quote,3
im waiting in my paper gown and plastic slippers for them to call me feeling very apprehensive but a bit dopey in the head due to lack of food,4
i also intended to study but that didn t happen either so here i am feeling a little less virtuous amp holier than thou than i would if i had actually done something constructive over the past week,1
i notice a lump or feel pain in any part of my body i will somehow become fearful or scared,4
i came away feeling that i should have felt unfortunate or cheated,0
i was feeling so regretful i didnt get it the other time,0
i will usually tell him that i was feeling frustrated for whatever reason and ask him to help me fix it,3
i always feel so delighted to know that there are so many other people who are just as inspired and in love with the old fashioned graphics and illustrations as i am,1
i went into the movie i was feeling skeptical and slightly nervous that i was going to be disappointed,4
i feel without being disturbed by it,0
i feel like im so fucking loyal i would never do that to my boyfriend so why am i settling for someone who doesnt have the same values,2
i cant feel them loving me back,2
im feeling a little saddened and troubled too sorry for a couple of friends who i wish i could give big hugs to,0
i hate all shopping when i feel rushed by hoards of people,3
id feel like a heartless bitch if i didnt share these with anybody,3
i understand that students must pass the mcas and fulfill other tasks but as idealized in freedom writers students will respond better learn and understand faster if they feel respected and valued and if they are excited about their education,1
i always forgive and am still feeling hurt,0
i feel frustrated and upset and demotivated when i dont see a whole picture of the curriculum that im studying for example english class,3
im trying to focus on not feeling sorry for myself and not being upset over the loss of a material possession,0
im feeling so disillusioned with it all right now,0
i am beginning to feel startled by how little of last week i remember,4
i feel superior because i actually know who their president is,1
i feel like other books i pick up are going to be dull and boring in comparison,0
i took steps and immediately remembered the feeling i had when my water broke with jack,0
i feel most passionate and artistic and settled into my craft,1
i cant let all these feeling in one blink im not a heartless person like you i give you a lot of change i give you a lot of change to come and change your decisions i give you a lot of change to find me but you threw it like a crap,3
im feeling a little stressed about it,0
i was also feeling really pleased that i decided well cajoled bullied and ordered to go out running this evening,1
i am slowly paying off my debts and i feel generally happy about where i am and what im doing,1
i need to take my own advice and the advice of many many writers who i admire get the butt in the chair every day even if youre feeling distracted or stressed or whatever,3
i feel fearless janelle mon e elle canada february img width height src http www,1
i need to tell someone how i feel you are gorgeous,1
i feel rude for ignoring your plea for help and its all your fault,3
i never have it feels insincere and a little nosy you get a hint that something might be wrong and want to jump in and get all the details,3
i love the museums there and although i love art i feel very dumb not knowing all of these paintings,0
ive to admit im feeling excited yet so unprepared for the surgery,1
i feel like im so enraged,3
i feel dumb for even liking you,0
im sure ill also feel a bit nervous,4
i can feel myself getting triggered by my emotional eating when i am sick with either a cold virus or just plain old stomach flu,0
i could listen for hours without feeling either threatened or the slightest bit shocked,4
i feel the divine envelope me when i watch literally hundreds of faithful at mass in line for eucharist hundreds of people who include professors homeless bankers students rich poor mentally ill healthy conservatives liberals gay straight sweet rude arrogant kind,1
im feeling a little uptight and pinched today,4
i like this so much but i feel like somehow this will be a term that becomes more popular in the future,1
im also feeling more energetic and able to keep going for a better part of the day,1
i feel generous this evening and id like to share a pie crust recipe to help those who have struggled with trying to make a pie,1
i am writing this i remember between feeling assured i wasnt dead and checking the window that me and my mom started fighting,1
i am already feeling homesick for a country that isnt mine own,0
i feel so selfish but i just want to keep my baby close for awhile and not let the rest of the world in unless i feel like it,3
i liked my keyboard being kicked in my teeth and feeling lousy about myself as a writer but because i want to know how i can improve and wonder what i did wrong to earn only one star,0
i feel the less successful pieces were my two front covers as the images i used here were taken from movie stills,1
i have the emotions but have learned that to feel them to let myself become agitated or excited means that my heart and heat jumps the regulated limits of what can be sustained,4
i feel confident that we will be blessed with other children in the lords timing,1
i am pleased and a little disturbed i guess that these feelings of melancholy lead me right back to the thing that brings them on,0
i feel like it is conor at his most sincere,1
i know i should just let the words flow like how they do when i blog but still i feel the pressure and that is making me unsure of my skills,4
i may be feeling more generous than normal but i really think a lot of teams did well in drafting good players at good spots and filling needs,1
ill let you in on a few more huge dieting secrets just because im feeling very festive and giving right now,1
i feel as though you are determined to annoy me you know i dont want you listening to the radio,1
i feel like i ll never be as graceful an,1
i am feeling stressed,0
i don t feel super strongly about it,1
i can feel the cold of winter,3
i feel and look gorgeous beautiful and sexy,1
im feeling all triumphant you may high five me if you choose mind you ill laugh at you but,1
i can no longer wear my t shirts without feeling like i m supporting a totally different band,1
ive been without a home without somewhere that i feel truly welcomed and safe,1
i feel more in control and less frightened about my headaches and migraine attacks excellent service,4
i am feeling extremely contented with our decision to home educate,1
i guess the trick is i need to go in strong and get what i want and not feel bashful over it,4
i was a bit too nervous to focus on the faces and the feeling was not unpleasant i wanted to put in a joke to start with especially since it involved the key note speaker and i thought it was funny,0
im starting to dislike the feeling of not caring about whats going to happen tomorrow,2
i really dont like the whole harvest y time feel im not keen on spending my time in the morning attempting to style my hair only to have it completely ruined within a minute of walking outside into the damp air,1
i feel we have a wonderful thing called a minute breathing space you can stop any time in the day even when you are driving along the motorway or in the middle of an important telephone call,1
i then said i dont know what you believe the most important day you have ever lived is but i want to share with you what i feel the most important day of your life is,1
i feel that time frame is going properly i m keen on you plenty probably we could repeat this once more and then the lady may possibly grin at you as well as claim the girl loves as well,1
i feel so bitchy suddenly,3
i feel like she has taken on the role of a grandmother to me since my beloved grandma is no longer with me,1
i like to finish on a positive note that whenever i feel a bit fearful or down i can just remember something nice about me and rich and it cheers me up,4
i feel defective or something,0
i feel really petty at the moment because i am extremely angry because im broke at the moment and it sort of pisses me off,3
i feel so lucky to have the opportunity to be here,1
