text,label
i started out feeling really optimistic and driven for this paper coz it was gonna teach me the meaning and ways of being a leader,1
i need to do the best i possibly can do and even when i get out at i feel too listless to study like right now,0
i drove us to the car parts place and terry feels like im safe to drive again so yippee,1
i am thankful for feeling useful,1
i feel like even though i dont buy into societys ideas about what a woman should look like i am still constantly unhappy with myself,0
i have no idea how i feel beyond wanting to be with my beloved,2
i don t want to tell people how my first was with you and how you made me feel i don t want to think that you re the most gorgeous guy i ve ever seen and i love how other people disagree because i don t want them to see how truly wonderful you are to me,1
i still feel like the admission that i don t like this popular show puts me in a category with people who kick puppies or people who or who steal the ratty clothes off the backs of dickensian orphans,1
i feel the character im doing is a little more beaten down and the comedy is a little bit smaller,0
i feel everything around me is fucked everyone around me is falling to pieces,3
i anyone another lovely day today weather am running late with life generally and not done any art today yet feel deprived bit of,0
i feel extremely insulted,3
i blanked a little on a lesson and she seamlessly jumped in to support me without making me feel stupid or inferring it to the kids,0
i feel like i smell this scent all over taiwan quite frequently in cute coffee shop bathrooms,1
i feel like im the one to be blamed for all things,0
i cant help feeling mad at this man,3
i guess it all just depends on my mood whether im feeling sociable or not,1
i think of how much time we spent just doing fun childhood stuff together as a family i feel amazed,5
i continued to feel very submissive and continued to be aroused as well,0
i told im i didnt want him to feel uncomfortable,4
i feel constantly at battle like i need to continuously improve myself but then feel like nothing i do will ever be enough and that makes me feel chronically exhausted,0
i feel like im a shy enormous pink flamingo man,4
i feel like as much as it was an unfortunate situation that i wasnt with my father i was in a great place,0
i just want to show them that i can take care of myself and i feel wronged by staying with them,3
i went ahead and did the shooting afterwards a few of the guys asked me to go out for drinks and i agreed i knew i should have rang you tried to work things out with you but i was angry and feeling stubborn,3
im listening to right now because i feel like i need it and i want to share it with you little ones despite my convinced atheism somehow it never fails to make me feel better,1
ive been comfort eating because im still feeling rubbish and i havent bothered to log most of it so theres no point checking on my food log yeah i know some of you do that,3
i feel so honored to be nominated for this award,1
im feeling quite joyful today,1
when i received the first year results as the first year had involved a lot of work and i was very pleased when i got the results,1
i feel like ive isolated myself from regular relationships,0
i am also not a perfect girl friend and im always a disappointment always feeling so doubtful and always putting you through a hard time with my mood swings and sudden outburst of low emo mood,4
i feel assured the world around me seems brighter,1
i cant hide my feeling when i feel so glad,1
i feel like how i m pissed that i have to spend an entire extra year in school because of stupid biochem,3
i am ready to cry because i feel such a sweet presence of the ruach hakodesh the holy spirit in my room with me right now,1
i feel confused too,4
i attempted to call my mom to talk to her but she answered the phone with suck fake regard for my feelings she had her jolly voice on and i just told her nevermind and she said okay i have a couple guests walking through the door so i have to go and feed them some pie,1
i feel for this little pound lovely is truly a gift,2
i posted on here and i m feeling very neglectful,0
i woke up monday feeling like crap and blamed it on the weather,0
i zoom into those difficulties into feeling like having to give up everything and feeling more then helpless alone in a desert cast out by the ways voices and actions of others that is another story when i zoom into it i also temporarily loose the view of the full picture,0
i didnt feel like anyone really hated me or noone new anyway and i managed to just not think about those who do,0
i have these random moments where i feel suddenly very creative and would love to sit down and hear the tick tick tick of the keyboard keys as my thoughts spilled out onto the screen,1
i feel nostalgic to travel away from my country my family and my friends not because i dont like them,2
i found these emails from scott dale and just reading them frusterated me so much that i feel the need to post them and show the world what a neurotic freak he was is,4
i smoothly hand her a twenty feeling smug that they are both interested,1
i did see some things that i would never have done myself for the movie adaption but feel that if i did not read the book it would not have bothered me,3
ive had to harden my heart to toughen my skin in order to truly protect myelf from feeling utterly devastated,0
i feel like its the perfect time to enlist some extra help,1
i somehow feel more vulnerable without it,4
i don t know how i feel about today because part of me is convinced that i am making this so much more difficult than it actually is or as mehow casually remarks in the april infield insider getting out of the box you are in that was never there in the first place,1
i was feeling a bit casual and put on a plain tank top with loose bottoms i got from zara,1
i think we i can get caught up in the nature of being busy of feeling the need to fill each moment with industry of some sort of occupying blank spaces with effort and chores,0
i am feeling very fearful that things arent going to go the way i want them to with my ex,4
i honestly feel kind of embarrassed and a bit guilty,0
i said i wanted to give you a little sample of the writing i denied you then but i m feeling a little more generous today i suppose because i just have to share one little taste,1
i feel a bit rotten putting a post about teaching into the stones tag list for this blog its not really a grumble or groan subject for me to be honest,0
ive learned in this short journey thus far is i know when my body has had enough of sugar and fast food and junk even though those days are far and few between i start to feel lethargic,0
i felt better on thursday and today friday felt good enough to come into work though i still feel kind of shitty and foggy,0
i just feel disappointed for losing he said,0
i need to get in touch with what i want and how i want to feel did i mention how much i hate people caring for me,2
i feel like a failure of a parent which add that to the emotional rollercoaster of having to have an unplanned c section and well some days i feel like i have just failed from the beginning,0
i feel rather intimidated by my re his impressive background and the clinic in general,4
i secretly well i guess not secretly anymore feel insecure about this but at the same time want them to learn how to come up with common ground by themselves,4
i need to feel assured i need to feel secure,1
i could genuinely feel loving toward someone without them ever knowing it if i dont act like it,2
i feel like the people that disliked it the most,0
i can never seem to get on the good foot and i feel so crappy,0
i want something that gives me a major orgasm that will make me feel so horny ill screw anything that moves,2
i drove home i was aware of feeling not like myself and then she called to ask if i was ok,1
i feel guilty for complaining about my life knowing that there are people out there who have it much worse than i do,0
id feel completely lost without him,0
im feeling discouraged i can look at that and remember i can achieve the goals i set for myself and i can always surprise myself with successes,0
i tried to explain what my lyme and coinfections feel like i guess i could say it is a horrible painful nightmare that just won t end,0
i cherish that feeling of babies asleep on my chest their amazingly sweet breath and the feeling they give me of i am needed,2
i can feel it weighing on me filling my thoughts as i try to do homework or help out at special olympics,1
i love the rainbow look that i have going on and think that it feels really festive i just hope the kids don t feel like it s suppose to be a constant party in our classroom thanks to the tissue paper balls,1
i feel incredibly idiotic but i was also embarrassed because it hadnt been their fault at all and i had yelled at one of the workers on the phone out of frustration about needing to call them a million times sending so many emails and still the problem was not solved,0
i feel so uncomfortable about the word hero,4
i can do to that would truly express the utter gratitude and thankfulness i feel for your sincere gesture and i am very grateful,1
i feel energized and eager to write tomorrow,1
i feel respected so his notions of feeling good or thinking good about someone become my notions of ensuring respect,1
i feel so ecstatic that i survived my comprehensive exams because i was never sure if i would survive not just pass but survive,1
i feel honoured to wear this one,1
i remember feeling very very violent and very disgusted the oscar winner tells access hollywood,3
i woke up on the sofa feeling extremely agitated around pm,4
i honestly don t think it s possible for me to feel romantic love at this point,2
i like build quality and how the button layout changes according to the phone s function i also like that the haptic feedback really feels like the phone has buttons herrman is still convinced there aren t haptics,1
i like listening to hardcore sxe music its the one thing that lets me feel rebellious while not chocolating out or spending till its gone,3
i feel the time at hand my beloved signals his agreement,2
i don t even feel particularly loyal to shell,2
i feel its casual and straight up,1
i feel ashamed that i so readily turn it aside,0
i guess they cant help but at least feel remorseful that she died so horribly and im pretty sure matt wasnt crying because he cared,0
i feel so annoyed,3
i just feel like a smarter more well rounded person because of it,1
i was bopping around the house yesterday singing to myself and possibly out loud just a bit i feel charming oh so charming,1
i am feeling very unsure of my future,4
i came across the exchange point feeling strong,1
i really remember is feeling wonderful in the oatmeal bath,1
i got separated from the man i loved,0
i feel todays schedule was an aching am to pm backed up by a mere hours of sleep one sandwich and tall espresso,0
i could feel the delicate pressure of her fingers searching to feel my arm beneath the course fabric,2
ive clawed time back and i still feel strong,1
i didn t walk the whole distance just sampled four or five stretches but i came home feel charmed by the experience,1
i love feeling brave,1
i wake up in the morning and have my voice and my throat feels ok but by the afternoon its all scratchy again and i sound like marge simpson until the night when its so bad and my throat is so sore i just have to whisper,1
im going to sleep now while i still feel triumphant,1
i have one of the guest rooms in our current house that was supposed to be my craft office closet but i honestly never use it since it is up stairs in a cold or hot room that i feel i can t get messy,0
i also have a niggling feeling that im getting complacent in my abilities,1
i feel at ease after sweet communing teach me it is far too little i know and do,2
i feel combination slightly superior sitting in on virtual event you ll feel as if it s another day office,1
i remember feeling the most terrified i had ever felt in my entire life and that its still affecting me now but ive never thought it accounted to trauma,4
i put up my christmas tree and im feeling fairly festive,1
i feel numb the way a wound does before it really starts to hurt,0
i didnt want others negative energy weighing us down and influencing my feelings and thought process during this special time,1
i feel glad and proud myself i could answer some complicated questions that i can t ever been done before,1
im just feeling very uncertain and,4
i tell people it feels like i am trying to convince people i am innocent but no one believes me,1
i feel very very burdened by so many situations around me right now,0
im not sure i relish the feeling of squelching mud between my toes when its contents are uncertain,4
i do not always find myself feeling thankful but over the years i ve gathered a few tricks that allow me to feel grateful in the face of moments when the last thing i want to do is say thanks,1
im constantly feeling alone,0
im taking advantage of feeling artistic incase it runs away again bell had her baby the other day yay,1
i still feel ashamed that i live in a world of people who dont know how,0
i don t want you to feel pressured into making love,4
i feel like im actually supporting myself by making use of what i know and love,1
i ask her what shed like to do and she just says she doesnt mind so i am always making suggestions and just feel like im having to try every day to keep her entertained,1
i like feeling suspicious and paranoid about everyone around me including my cat spending way too much time on self loathing thoughts sinking into unwarranted and unnecessary depression and then feeling supremely guilty for acting like such a bitch,4
i honestly believe those darker days are the reason i push so hard to be someone of worth in my future i feel it is my duty to make up for all the time i lost,0
i still want to be a lady who likes ladies who does not feel inhibited to kiss another woman in public but i guess i will just have to disregard societal views that pertain to my sexual preferences and how i portray them,0
i done something that i didn t feel inspired or challenged by,1
i feel that everyone has the ability to be artistic in his or her own special way and find that the most attractive art is unleashed fromthe virgin artists,1
i think the energy in our jobs and in our writing should not always be spent on what we think will sell but rather on our pet projects we truly feel invigorated about,1
im even starting to feel more sociable,1
i actually feel quite scared to get back to exercising because i feel like ive lost so much strength and condition and put on so much weight,4
i find it hard to feel jolly when throngs of people around me are so lost in the fervor of getting stuff that they cant see their heart for the green in their wallet encouraged by the constant barrage and pressure from every angle to shop here and buy more,1
i think he feels pretty cute in this,1
i wanted to go and ask him about my batting but was feeling hesitant about approaching such a big player,4
i got a bit caught up in the moment and forgot that at the core of the rude comments and silly songs were the real feelings of a beloved and brilliant comic actor and a very sweet and big hearted young woman,1
ive been feeling a bit overwhelmed with the whole marathon idea lately,4
i know i would feel weird about that and probably act strangely for a few days,5
i feel like an impostor in my work as i smile and talk about behavior contracts positive reinforcement cognitive reframing physical activity and other means for diminishing dissolving or deferring the pain of reality,1
i feel suspicious if there is no one outside like the rapture has happened or something,4
i feel so deeply shocked and saddened,5
i did manage two short runs and a walk but today im back to feeling just shy of awful,4
im told by horsey people that they are a rare find so i feel quite lucky,1
i have not spent that much time with them but i just don t feel that comfortable there,1
i think i brag and it feels strange because i still see myself as a little fattie pre teen unworthy of any male attention,5
i cant help but feel a little humiliated,0
i don t feel depressed for lack of a husband all the time,0
i feel really lucky to be part of what looks like an active and friendly homeschooling group here in dubai,1
i kicked you in the throat and now i feel terrific,1
im feeling much more positive about the impending move,1
i want her to still feel appreciative of things i do for her,1
i am feeling mellow excited about it partly because i know annie will churn all kinds of emotions inside of me esp,1
i want her to be able to trust me with everything i want her to feel like she is the most valuable thing on the face of the earth i want her to feel like there is nothing that i could ever even consider thinking about because of how amazing she is,1
im glad i have a god with whom i can feel safe,1
i doubles victory over brown struff we went back on sunday feeling really optimistic and looking forward to another day filled with more fedtastic tennis,1
i face turn red and feel shy emm no,4
i hoped to get from her this weekend in an attempt to not feel so utterly isolated inside ambleside with the curtains firmly closed on what was the warmest sunniest day of the year so far,0
i felt the sadness and remorse we are supposed to feel when we realize we have wronged someone corinthians,3
i really feel that we are progressing towards a society that is more fearless incrementally throwing away seemingly rigid boundaries like paranoia over security of one s belongings a href http www,1
i feel so unimportant insignificant like im slipping through the gaps between his fingers and he doesnt care,0
i am feeling a tad smug right now,1
i think browsers are more comfortable in my booth if all my attention is not focused on them and they don t feel pressured to make a purchase,4
i did develop unknown feelings for him i think thats the reason why i feel like ive been settling for all the other guys who liked me,2
i wasnt feeling that hot prior to vineman but with a little racin and a lot of self talk im now in a better spot mentally and physically,2
i visit m ller in my country and go to the expensive make up stands the sales assistants are always standing right next to me and looking at me like im going to steal something so i feel really uncomfortable shopping there,4
i was eager to know why i was feeling unhappy and unsatisfied,0
i feel crappy actually,0
i feel so invigorated so focused about what im being led to pursue right now and in the future,1
i feel i am shy and i am afraid of keeping my point of view,4
i feel like i get a lot of questions in my list of search phrases that point people here and sometimes i m awfully disturbed at the things that somehow bring my blog up in a search engine,0
i couldn t help but feel sympathetic for netflix as an army of the misinformed denounced netflix for the recent price hike,2
im not going to lie i feel a little insulted,3
i feel peaceful and unafraid certain that my god has my best interests at heart,1
i feel awful and have had chills on and off day and night,0
i was feeling at the start didnt want to move much at all was really glad to experience this glimpse into the sort of vibrant energy i will gain through out the year,1
i feel virtuous for going to spin class then driving all the way to blackburn in the manual unsupervised and sucessfully handbrake starting,1
i feel like nothing can stop me and sometimes i feel like so defeated,0
i email authors about interviews i feel a little intimidated,4
i believe people who use fulsome manners only for social reasons they aren t on the top of the scale of human evolution and i feel hurt by their fake behavior,0
im not necessarily sure what but something in the education system must change or students can feel anxiety and pressure with needing to be flawless with their vast knowledge of the world,1
i dont think my desire level is too much to bear but i feel unwelcome,0
i am feeling a lil bit gloomy,0
i find that i never stop feeling excited for our company s future,1
i am grateful for every single thing i have maybe then ill start feeling dismayed when i don t have more,0
i feel so stupid to think they will trust me,0
i feel awful everytime ac,0
i like the feeling of making some difference this time i was really reluctant to change at first however get used to it after a while,4
i feel like life was so flawless for so very long and now i am stressed out and wanting to cry half the time,1
i feel shafted or greedy,3
i stop feeling so depressed and,0
i feel so emotional reaching three finals in four years,0
i wasnt feeling well yesterday and today has been randomly busy,1
i the ultimate place to restore the peace to feel divine to kneel for worship and to attain hapiness,1
im feeling really positive desp,1
i feel when i read your words and realize one more time just how very good of a writer you are the feeling of shared sympathies,1
i feel pity for gatsby because the longing he feels for the past is so evident,2
i met you i used to want to lock myself into a vault just to feel precious,1
i really hate that feeling when youre unsure about something,4
i feel like those rich people all fall into the category of don t belong when i see them on the bus,1
i write which is what i consider my real profession even though by teaching poetry to troubled and poor kids i feel i m doing something useful,1
i feel honored to be witness to another s process,1
i had a horrible tragedy something that i was terribly ashamed of or something that was causing me great pain or that was making me feel vulnerable i have more than just one or two very trusted people who i know i could call for help,4
i feel stupid and incapable and i dont know what i want to do and work is stupid and only for the next two weeks and i m questioning everything,0
i am writing this at a time when i have also had an upset with the only real parent i have had almost constantly in my life and when theres no brothers and sisters around either i am an only child it feels kinda lonely,0
i feel like this concert was much more successful than the previous one,1
i was just feeling needy,0
i also feel so awful feeling this way,0
i always intended on achieving just so i could be with everyone else and feel like i was an intelligent productive and successful person,1
i feel like i have been beaten hard with a baseball bat under my arm which the doctor said was a very apt description,0
i feel overwhelmingly remorseful and guilty when i watch too much news or too many sad movies or television dramas,0
i feel completely drained physically and mentally worn out,0
i feel wonderful im tipping over backwards im so ambitious im looking back im running a race and youre the books i read so feel my fingers as they touch you arms im spinning around and i feel alright the book i read was in your eyes,1
im feeling so broke right now but i loved every minute of it,0
i want to say that i feel vulnerable writing and sharing this info,4
i was using it to vent out ugly feelings and be vicious and nasty rather then deal with them like an adult,3
i always thought that if i contracted something from one of those people and passed it on to him that i d feel awful but after i got the sti test i thought i was basically in the clear,0
i didnt feel that there were enough strong smart and funny female main characters in fiction and since thats what i imagine myself to be i started writing,1
i would just go to the straight point rather than doing a defination of such as what is romance feeling or anger feeling or suspicious feelings,4
i wasnt feeling casual much,1
i feel slightly emotional watching it,0
i feel like i ve regained another vital part of my life which is living,1
i went up to the teacher and said im gonna step outside for a second im really not feeling too well,1
i pray that each of you who is hurting or feeling afraid tonight finds peace and soon,4
i could feel myself getting that shaky feeling,4
i feel more crucified heartbroken tortured and forsaken than i have ever before felt but not at the hands of my enemy at the hands of those i love,0
i feel like he was more important to me than i thought he was,1
i believe its possible to be joyful and full of thanks while feeling overwhelmed and exhausted by life,5
i want people to feel brave and i want society to accept us as disabled people amongst us who deserve dignity and respect not to be shunned and laughed at,1
im feeling awfully spiteful right now,3
i feel more of a sense of longing than of loss,2
i guess you cant see how wed feel a bit unwelcome,0
i stay up and feel foolish,0
i think people born in the s and s hold the key to opening many doors for us we just need to make them feel treasured enough to share it,2
i would like to reduce the amount of jealousy i feel god commands us not to be jealous and i feel that every jew religious or not should obey that prohibition,3
i feel so highly intimidated that i get flustered and cant form my words not even in english with her,4
i feel reluctant talking about myself and my current situation to you as i don t know how you ll feel but i guess its important you know all about me and the situation i am in so that we ll know if we can go further,4
